{
  "$schema": "http://json-schema.org/draft-07/schema#",
  "$id": "https://michi.link/schemas/sync-delta.schema.json",
  "title": "SyncDelta",
  "description": "Incremental sync delta response. Cursor is the official field; since/manifest_id are legacy.",
  "type": "object",
  "required": ["cursor", "added", "updated", "deleted", "playlists_updated"],
  "properties": {
    "cursor": {
      "type": "string",
      "description": "Opaque cursor token for the next delta request",
      "minLength": 1,
      "examples": ["cursor_delta_001_a1b2c3d4"]
    },
    "added": {
      "type": "array",
      "description": "Entities added since the cursor",
      "items": {
        "type": "object",
        "required": ["type", "id", "data"],
        "properties": {
          "type": { "type": "string", "enum": ["track", "album", "artist", "playlist"] },
          "id": { "type": "string", "description": "Entity ID" },
          "data": { "type": "object", "description": "Full entity data" }
        }
      }
    },
    "updated": {
      "type": "array",
      "description": "Entities modified since the cursor",
      "items": {
        "type": "object",
        "required": ["type", "id", "data"],
        "properties": {
          "type": { "type": "string", "enum": ["track", "album", "artist", "playlist"] },
          "id": { "type": "string", "description": "Entity ID" },
          "data": { "type": "object", "description": "Updated entity data" }
        }
      }
    },
    "deleted": {
      "type": "array",
      "description": "Entities removed since the cursor",
      "items": {
        "type": "object",
        "required": ["type", "id"],
        "properties": {
          "type": { "type": "string", "enum": ["track", "album", "artist", "playlist"] },
          "id": { "type": "string", "description": "Removed entity ID" }
        }
      }
    },
    "playlists_updated": {
      "type": "array",
      "description": "Playlists whose track ordering changed",
      "items": {
        "type": "object",
        "required": ["playlist_id"],
        "properties": {
          "playlist_id": { "type": "string" },
          "added": { "type": "array", "items": { "type": "string" }, "description": "Track IDs added" },
          "removed": { "type": "array", "items": { "type": "string" }, "description": "Track IDs removed" }
        }
      }
    }
  }
}
